{
  "meeting_type": "Project review",
  "attendees": [
    "Chloe Green",
    "Dan Wu",
    "Marta Silva",
    "Neil Foster"
  ],
  "client_attendees": [
    "Chloe Green",
    "Dan Wu",
    "Marta Silva",
    "Neil Foster"
  ],
  "actions": [
    {
      "owner": "Not stated",
      "action": "Review transcript for agreed actions.",
      "due_evidence": "Not stated"
    }
  ],
  "decisions": [],
  "risks": []
}
