{
  "meeting_type": "Project review",
  "attendees": [
    "Grace Lin",
    "Idris Moore",
    "Kate Evans"
  ],
  "client_attendees": [
    "Grace Lin",
    "Idris Moore",
    "Kate Evans"
  ],
  "actions": [
    {
      "owner": "Idris Moore",
      "action": "Send the draft",
      "due_evidence": "end of day tomorrow"
    },
    {
      "owner": "Kate Evans",
      "action": "Review the draft",
      "due_evidence": "within two working days of receiving it"
    },
    {
      "owner": "Grace Lin",
      "action": "Submit the approved draft",
      "due_evidence": "the next working day after Kate's approval"
    },
    {
      "owner": "Kate Evans",
      "action": "Review it within two working days of receiving it",
      "due_evidence": "Not stated"
    }
  ],
  "decisions": [
    "The submission timing is contingent on receiving approval from Kate Evans.",
    "The contingency plan for the final submission was implicitly linked to the approval process."
  ],
  "risks": []
}
