{
  "meeting_type": "Decision meeting",
  "attendees": [
    "Elaine Voss",
    "Martin Okoro",
    "Sana Iqbal"
  ],
  "client_attendees": [
    "Elaine Voss",
    "Martin Okoro",
    "Sana Iqbal"
  ],
  "actions": [
    {
      "owner": "Not stated",
      "action": "Review transcript for agreed actions.",
      "due_evidence": "Not stated"
    }
  ],
  "decisions": [],
  "risks": []
}
