{
  "meeting_type": "Project review",
  "attendees": [
    "Gemma Ashworth",
    "Raj Patel",
    "Louise Corrigan",
    "Tobias Frank"
  ],
  "client_attendees": [
    "Gemma Ashworth",
    "Raj Patel",
    "Louise Corrigan",
    "Tobias Frank"
  ],
  "actions": [
    {
      "owner": "Not stated",
      "action": "Review transcript for agreed actions.",
      "due_evidence": "Not stated"
    }
  ],
  "decisions": [],
  "risks": []
}
